,review_text,review_rating,BERT_score,issue
43,"This vest has it all.  It has a place for your phone that, once secured, allows you to pull down the flap it’s in and see the screen through the clear plastic window.  But, the flap is secured with both Velcro and a snap.  You have to really want to look at your phone.  The touch screen worked great for me with my Pixel 6 Pro.  There is another storage area behind the phone sleeve (it’s in the same velcroed flap as the phone goes in).  I don’t know what I’d put in there, but I’d say you could fit a passport or something of a similar size in it.  This vest also has a zippered pocket on the left shoulder—perfect for a key or credit card or ID—and a small velcroed pocket on the right shoulder, which could easily hold some lip balm.  It comes with a collapsible bite-valve water bottle, though you will need to make an effort to get the plastic taste out of it.  It has a reflective strip on the back.But, most importantly, this vest will not move as you run.  It is very secure and stable.  The mesh back makes it pretty breathable, and it’s definitely lightweight and very comfortable.For reference, I’m 5’7”, 126#, 34C, and this fit perfectly on the tightest strap setting.",5.0,5,none
44,"Tested this baby out hiking this last weekend.... I LOVE IT.  I have several things that I love about this vest:1.  The areas with the holes are almost like the body glove fabric so it breathes really well and has a sort of cooling effect.2.  The cell phone pocket is amazing! I love that you can put your phone in there and if you wanted to change your music you can either leave it hanging while you are running or you can Velcro it up and pull it down to change the music.  This is life changing because I no longer have to worry about dropping my phone while I'm running or needing to stop to change my music3.  The water bottle has a bite valve so you can get water out of it without even removing it from the pocket4.  The zipper pocket on the left shoulder is large enough for a key fob which is really nice!The only thing that I wish this vest had was a metal loop to hook my dog to but honestly, I'd buy this vest again regardless of that.",5.0,5,none
45,"The Zelvot Running Vest for Women and Men is a practical and well-designed piece of gear, ideal for those who enjoy daily walks or runs. One of the standout features is that it comes with a water bottle, though I prefer not to place it in the designated pocket as it tends to add extra weight. Despite this, the vest itself is incredibly lightweight and comfortable to wear.An important note is that the vest has a size limit, so be sure to check the sizing to ensure a proper fit. The adjustable chest straps help achieve a secure and customizable fit, but verifying the size beforehand is crucial.The touchscreen pocket is a fantastic addition—it's sweatproof, which is perfect for keeping your phone dry. I appreciate the convenience of being able to unbuckle the vest without my phone falling out, thanks to the secure Velcro patch. Overall, this running vest has become my go-to for daily walks, offering a combination of comfort, practicality, and thoughtful design features.",5.0,4,none
46,Nice running vest. Comfortable to wear. Great for. Nice moisture wicking natural. Holds a good size water bottle in from pocket. Nice lightweight design. Size was adjustable.,5.0,5,none
47,"I really like this hydration vest.  It has adjustable front straps to loosen or tighten to fit you just right.  It comes with a hydration flask that will carry 1-2 hours of water while you are active.  What I like about this the most is it has a clear phone holder that snaps and velcros open and close, so you can easily view who is calling or control your music while you are on the go.  The fabric is lightweight and breathable, though not as much as pure mesh.  Also, the vest has a back pocket and a reflective strip to keep you safe at night.  Overall, this is a great product, especially for the price point!",5.0,4,none
48,"It’s a good quality running vest for the price ..i like the color and it comes with the hydration bottle ,size are good for a petite/short person like me sit right below my rib cage ,i like the extra pockets where i can put my keys and running gels most of all the phone pocket is such a genius it can actually fit my Iphone pro max which is huge! Highly recommended👌🏻👌🏻👌🏻",5.0,5,none
49,"Never know what to do with all my stuff (phone, keys, and water) while I’m jogging, and this is a great solution. I’m actually a new jogger, so I didn’t know such nifty stuff was available. I like that this has adjustable straps. It’ll fit many sizes.",5.0,5,none
50,This is a lightweight vest with a handy refillable bottle to keep you hydrated while running or hiking. It is ventilated to help you stay cool and the water bottle easily fits inside the pocket.,5.0,5,none
51,Perfect for my runs,5.0,5,none
52,"This running vest combines style and functionality seamlessly. Its sleek design offers a modern aesthetic while providing ample storage space for essentials during your run. The fit is true to size, hugging the body comfortably without feeling restrictive. Whether you're hitting the pavement or tackling trails, this vest offers the versatility and comfort you need to perform at your best.",5.0,5,none
53,It is a bit too thick for my liking but the touch screen + water pouch is a great addition.,3.0,4,none
54,"The vest is incredibly lightweight and breathable, which is perfect for my long runs. It has enough pockets to store all of my essentials without feeling bulky or getting in the way. The reflective strips also provide added safety for running in low light conditions. Overall, I would highly recommend this running vest to anyone looking for a comfortable and practical option for their runs.",5.0,5,none
55,"THESE RUN ON THE SMALL SIDE. WAY SMALL. EVEN WITH THE STRAP EXTENDED, I COULDN'T GET THIS TO CLASP. IT SEEMS LIKE GOOD QUALITY MATERIAL AND IT LOOKS NICE, AND ALSO IS IN THE PRICE RANGE I WOULD EXPECT. THE SIZE TOOK TWO STARS FROM THIS REVIEW THOUGH, AS THIS FITS MORE LIKE A MEDIUM.",3.0,2,none
56,"Comes with soft water bottle, perfect! Thank you so much.",5.0,5,none
57,"It looked a little too small at first but it first perfectly on my husband (size M). It was great for storage of water and phone on our hike. It feels very lightweight so it will be perfect all year round. Looks expensive, and the material feels nicer than some big name brands.",5.0,5,size
58,"Handy vest for running, hiking, biking. But can't imagine this is one size fit all. Barely fit me and not big guy. Also joggers need better straps so phone does not bounce. Product as is would have very limited appeal.",3.0,3,none
59,Adjustable chest straps. It has five pockets. It looks good. It's lightweight. And it can help keep you cool while running.,5.0,5,none
60,Reflection is great.  A small water bottle.  Storage.  And easy to strap on while staying comfortable even during long runs.Try this if you’re a runner or walker.  I tried several products to carry water while I jog.  The waist fanny pack style water bottle ones bounce too much.,5.0,4,none
61,"Crafted with lightweight and breathable materials, this vest provides the perfect balance of comfort and performance during workouts or outdoor activities. Its form-fitting design offers a flattering silhouette without restricting movement, allowing you to move freely with every stride",5.0,5,none
62,"Got this for my daughter who runs track. She runs every day on her own and I'm always afraid she's gonna dehydrate.  I should've paid better attention.  She has a small frame, so we didn't want anything very big and bulky for her.  But, even though this one is lightweight and NOT bulky, it only carries a 500ml bladder, which is roughly 16 ounces.  That's 2 cups of water.  And, even though you're not supposed to drink A LOT when you're running because it can upset your stomach, when she's running several miles per day in the hot Texas heat, 2 cups is not near enough.",3.0,4,none
63,"This item fits perfectly, holds the items I need and is good quality. It keeps your legs and arms free.",5.0,5,none
64,Super compact.  Nice materials.  Fits great.  Good value.  Adjusts perfectly.,5.0,5,none
65,"This running vest is great! It’s comfortable and lightweight. My favorite feature is the phone compartment, which makes it easily accessible for quick use. I also like the reflective stick on the back for night running.",5.0,5,none
66,I use this on my daily running with my son. Keeps everything safe and secure,5.0,5,none
67,"The vest is comfortable on the tightest setting for me but not for long-the fasteners at the front slip out of place very easily resulting in me having to adjust it every few minutes, which believe me is very annoying! The only thing I liked about this vest is the phone holder and extra pockets for keys.update: customer service sent me a replacement in Pink (so pretty!) and the straps no longer has this issue. The updated product is truly amazing and I have nothing bad to say about it except that it can get a bit hot in summer.",5.0,2,none
68,"The vest exceeded my expectations. It fits perfectly with adjustable straps for a snug, comfortable fit. The lightweight, breathable material keeps me cool, and the vest has ample storage for essentials with secure zippers. Reflective strips ensure high visibility for safety during low-light runs. The durable build quality shows no signs of wear after weeks of use. Highly recommended for any runner!",5.0,5,none
69,I havent used it but it seems like a comfortable vest and the pockets are spacious enough for a phone or other things like a wallet. The soft flask also seemed like a good quality. Unfortunately had to return it as the middle fastener is missing.,4.0,3,none
70,Love this vest. The pockets fit everything I need for a long run and the adjustable straps are exactly what I was looking for.,5.0,5,none
71,New vest with updated straps solved the issue of the straps loosening while running. Excellent customer service that exceed expectations!Vest is nice for long runs!,5.0,5,none
72,"package says for women and M/L. How an outfit can be Medium and Large at the same time when it is not stretchable.I think this style is more suitable for small size chest person. M/L is rally XS for a men.Phone location at front and water at the back good design.  Material is heavy duty may not suitable for a long distance runner. For hiking and walking and jogging is good for people who don't want to wear a belt.I noticed another L/XL version of listed of this product another site. I would imagine this will be lower.price fort M/L was ok, however L/XL is +cad$15 more.  At that price range Osprey's new designs starting at cad$100. Price for M/L for small body will fit and price is reasonable for good design. Too bad it didn't  have more sizes listed in the same product page. In Product description it should indicate minimum chest size. Rather than indicating M/L. This is not how it should be sold.",3.0,3,none
73,"La veste est pratique, belle, je l’adore. Par contre elle n’est pas fait pour les très grosses poitrines. Sinon, super légère je ne la sens même pas sur moi. Et que dire de la gourde souple qui vient avec 🤩 c’est beau, pratique et ' génial 🙌🏼",5.0,4,none
